{
  "schemaVersion": 3,
  "autoCommitRepositoryUrls": [
    "https://example.com/acme/owned-project.git"
  ],
  "excludedRepositoryUrls": [
    "https://example.org/acme/planning-only-project.git"
  ],
  "excludedRepositoryPaths": [
    "docs/architecture-planning"
  ],
  "catalog": {
    "repository": "https://github.com/example/ai-instructions.git",
    "ref": "89abcdef0123456789abcdef0123456789abcdef",
    "profiles": [
      "core"
    ],
    "includeSkills": [
      "work-with-jira"
    ],
    "excludeSkills": [
      "capture-private-course-knowledge"
    ]
  }
}
